{
  "video_id": "vid_01",
  "provider": "whisper",
  "text": "Hello world",
  "segments": [
    {
      "start_ms": 0,
      "end_ms": 1000,
      "text": "Hello world"
    }
  ],
  "audio_ref": {
    "bucket": "audio-tracks",
    "key": "vid_01/audio.wav"
  },
  "storage_ref": {
    "provider": "minio",
    "bucket": "transcripts",
    "key": "vid_01/transcript.json"
  },
  "created_at": "2026-01-01T00:00:00Z"
}
